{
  "$schema": "http://json-schema.org/draft-07/schema#",
  "$id": "https://taskmanagedai.local/eval/quality/citation_coverage/expected_schema.json",
  "title": "AC-KPI-04 citation_coverage fixture",
  "type": "object",
  "additionalProperties": false,
  "required": [
    "fixture_id",
    "dataset_version_id",
    "fixture_kind",
    "kpi_id",
    "metric_key",
    "case_key",
    "input",
    "expected_aggregate",
    "threshold",
    "assertions",
    "anti_gaming",
    "metadata"
  ],
  "properties": {
    "fixture_id": { "type": "string", "pattern": "^AC-KPI-04_" },
    "dataset_version_id": { "type": "string", "pattern": "^v[0-9]{4}\\.[0-9]{2}\\.[0-9]{2}(-[A-Za-z0-9_.-]+)?$" },
    "fixture_kind": { "type": "string", "const": "public_regression" },
    "kpi_id": { "type": "string", "const": "AC-KPI-04" },
    "metric_key": { "type": "string", "const": "citation_coverage" },
    "case_key": { "type": "string", "minLength": 1 },
    "input": {
      "type": "object",
      "additionalProperties": false,
      "required": ["evidence_set_hash", "dataset_version", "sample_claims"],
      "properties": {
        "evidence_set_hash": { "type": "string", "pattern": "^[a-f0-9]{64}$" },
        "dataset_version": { "type": "string", "minLength": 1 },
        "sample_claims": {
          "type": "array",
          "minItems": 1,
          "items": {
            "type": "object",
            "additionalProperties": false,
            "required": ["claim_id", "claim_text", "evidence_ids", "citation_ids"],
            "properties": {
              "claim_id": { "type": "string", "minLength": 1 },
              "claim_text": { "type": "string", "minLength": 1 },
              "evidence_ids": {
                "type": "array",
                "items": { "type": "string", "minLength": 1 }
              },
              "citation_ids": {
                "type": "array",
                "items": { "type": "string", "minLength": 1 }
              }
            }
          }
        }
      }
    },
    "expected_aggregate": {
      "type": "object",
      "additionalProperties": false,
      "required": ["total_claims", "claims_with_citation", "coverage_ratio"],
      "properties": {
        "total_claims": { "type": "integer", "minimum": 1 },
        "claims_with_citation": { "type": "integer", "minimum": 0 },
        "coverage_ratio": { "type": "number", "minimum": 0, "maximum": 1 }
      }
    },
    "threshold": {
      "type": "object",
      "additionalProperties": false,
      "required": ["operator", "value"],
      "properties": {
        "operator": { "type": "string", "const": ">=" },
        "value": { "type": "number", "minimum": 0, "maximum": 1, "const": 0.9 }
      }
    },
    "assertions": {
      "type": "array",
      "minItems": 1,
      "items": {
        "type": "object",
        "additionalProperties": false,
        "required": ["name", "expected"],
        "properties": {
          "name": { "type": "string", "minLength": 1 },
          "expected": { "type": "string", "minLength": 1 }
        }
      }
    },
    "anti_gaming": {
      "type": "object",
      "additionalProperties": false,
      "required": [
        "private_expectation_visible_to_policy_author",
        "append_only_refresh",
        "separate_fixture_and_policy_commits"
      ],
      "properties": {
        "private_expectation_visible_to_policy_author": { "type": "boolean", "const": false },
        "append_only_refresh": { "type": "boolean", "const": true },
        "separate_fixture_and_policy_commits": { "type": "boolean", "const": true }
      }
    },
    "metadata": {
      "type": "object",
      "additionalProperties": true,
      "required": ["created_at", "notes"],
      "properties": {
        "created_at": { "type": "string", "format": "date" },
        "notes": { "type": "string" }
      }
    }
  }
}

